{
  "previewInstruction": "<p><strong>Fruit Basket Pairs!</strong> 🍎 Tap every pill where the two fruit counts add up to the basket size shown at the top.</p><p>Tap each pair in <strong>under 2 seconds</strong> to earn a fast-tap star — collect up to 10 fruits! 🍊</p><p>You have <strong>3 baskets</strong> across all 4 levels. Don't drop a wrong pair!</p>",
  "previewAudioText": "Fruit basket pairs! Tap every pill where the two fruit counts add up to the basket size shown at the top. Tap each pair in under two seconds to earn a fast-tap star — collect up to ten fruits! You have three baskets across all four levels. Don't drop a wrong pair.",
  "previewAudio": null,
  "showGameOnPreview": false,
  "totalRounds": 4,
  "totalLives": 3,
  "answerComponent": true,
  "rounds": [
    {
      "set": "A", "id": "fruit_A_r1_basket10_warmup", "round": 1, "stage": 1, "type": "A", "targetSum": 10, "levelTitle": "Fill the 10 Basket",
      "pills": [
        { "a": 6, "b": 4, "id": "p1" }, { "a": 5, "b": 4, "id": "p2" }, { "a": 2, "b": 8, "id": "p3" }, { "a": 7, "b": 2, "id": "p4" },
        { "a": 5, "b": 5, "id": "p5" }, { "a": 4, "b": 7, "id": "p6" }, { "a": 6, "b": 5, "id": "p7" }, { "a": 8, "b": 4, "id": "p8" }
      ],
      "correctPills": ["p1", "p3", "p5"],
      "misconception_tags": { "p2": "sum-off-by-one-under", "p4": "sum-off-by-one-under", "p6": "sum-off-by-one-over", "p7": "sum-off-by-one-over", "p8": "sum-off-by-two-over" },
      "answer": { "correctPills": ["p1", "p3", "p5"], "targetSum": 10, "expressions": ["6 + 4", "2 + 8", "5 + 5"] }
    },
    {
      "set": "A", "id": "fruit_A_r2_basket20_switch", "round": 2, "stage": 2, "type": "A", "targetSum": 20, "levelTitle": "Fill the 20 Basket",
      "pills": [
        { "a": 13, "b": 7, "id": "p1" }, { "a": 12, "b": 7, "id": "p2" }, { "a": 12, "b": 8, "id": "p3" }, { "a": 15, "b": 4, "id": "p4" },
        { "a": 14, "b": 6, "id": "p5" }, { "a": 11, "b": 8, "id": "p6" }, { "a": 13, "b": 8, "id": "p7" }, { "a": 16, "b": 6, "id": "p8" }
      ],
      "correctPills": ["p1", "p3", "p5"],
      "misconception_tags": { "p2": "sum-off-by-one-under", "p4": "sum-off-by-one-under", "p6": "sum-off-by-one-under", "p7": "sum-off-by-one-over", "p8": "sum-off-by-two-over" },
      "answer": { "correctPills": ["p1", "p3", "p5"], "targetSum": 20, "expressions": ["13 + 7", "12 + 8", "14 + 6"] }
    },
    {
      "set": "A", "id": "fruit_A_r3_basket10_dense", "round": 3, "stage": 3, "type": "A", "targetSum": 10, "levelTitle": "Fill the 10 Basket",
      "pills": [
        { "a": 7, "b": 3, "id": "p1" }, { "a": 6, "b": 3, "id": "p2" }, { "a": 8, "b": 2, "id": "p3" }, { "a": 5, "b": 6, "id": "p4" },
        { "a": 4, "b": 6, "id": "p5" }, { "a": 9, "b": 2, "id": "p6" }, { "a": 9, "b": 1, "id": "p7" }, { "a": 4, "b": 4, "id": "p8" }
      ],
      "correctPills": ["p1", "p3", "p5", "p7"],
      "misconception_tags": { "p2": "sum-off-by-one-under", "p4": "sum-off-by-one-over", "p6": "sum-off-by-one-over", "p8": "sum-off-by-two-under" },
      "answer": { "correctPills": ["p1", "p3", "p5", "p7"], "targetSum": 10, "expressions": ["7 + 3", "8 + 2", "4 + 6", "9 + 1"] }
    },
    {
      "set": "A", "id": "fruit_A_r4_basket20_fluency", "round": 4, "stage": 4, "type": "A", "targetSum": 20, "levelTitle": "Fill the 20 Basket",
      "pills": [
        { "a": 15, "b": 5, "id": "p1" }, { "a": 14, "b": 5, "id": "p2" }, { "a": 11, "b": 9, "id": "p3" }, { "a": 10, "b": 9, "id": "p4" },
        { "a": 13, "b": 7, "id": "p5" }, { "a": 13, "b": 8, "id": "p6" }, { "a": 12, "b": 8, "id": "p7" }, { "a": 12, "b": 9, "id": "p8" }
      ],
      "correctPills": ["p1", "p3", "p5", "p7"],
      "misconception_tags": { "p2": "sum-off-by-one-under", "p4": "sum-off-by-one-under", "p6": "sum-off-by-one-over", "p8": "sum-off-by-one-over" },
      "answer": { "correctPills": ["p1", "p3", "p5", "p7"], "targetSum": 20, "expressions": ["15 + 5", "11 + 9", "13 + 7", "12 + 8"] }
    },
    {
      "set": "B", "id": "fruit_B_r1_basket10_warmup", "round": 1, "stage": 1, "type": "A", "targetSum": 10, "levelTitle": "Fill the 10 Basket",
      "pills": [
        { "a": 1, "b": 9, "id": "p1" }, { "a": 2, "b": 7, "id": "p2" }, { "a": 3, "b": 7, "id": "p3" }, { "a": 6, "b": 3, "id": "p4" },
        { "a": 8, "b": 2, "id": "p5" }, { "a": 4, "b": 5, "id": "p6" }, { "a": 3, "b": 8, "id": "p7" }, { "a": 9, "b": 3, "id": "p8" }
      ],
      "correctPills": ["p1", "p3", "p5"],
      "misconception_tags": { "p2": "sum-off-by-one-under", "p4": "sum-off-by-one-under", "p6": "sum-off-by-one-under", "p7": "sum-off-by-one-over", "p8": "sum-off-by-two-over" },
      "answer": { "correctPills": ["p1", "p3", "p5"], "targetSum": 10, "expressions": ["1 + 9", "3 + 7", "8 + 2"] }
    },
    {
      "set": "B", "id": "fruit_B_r2_basket20_switch", "round": 2, "stage": 2, "type": "A", "targetSum": 20, "levelTitle": "Fill the 20 Basket",
      "pills": [
        { "a": 11, "b": 9, "id": "p1" }, { "a": 10, "b": 9, "id": "p2" }, { "a": 16, "b": 4, "id": "p3" }, { "a": 13, "b": 6, "id": "p4" },
        { "a": 17, "b": 3, "id": "p5" }, { "a": 14, "b": 7, "id": "p6" }, { "a": 12, "b": 9, "id": "p7" }, { "a": 13, "b": 5, "id": "p8" }
      ],
      "correctPills": ["p1", "p3", "p5"],
      "misconception_tags": { "p2": "sum-off-by-one-under", "p4": "sum-off-by-one-under", "p6": "sum-off-by-one-over", "p7": "sum-off-by-one-over", "p8": "sum-off-by-two-under" },
      "answer": { "correctPills": ["p1", "p3", "p5"], "targetSum": 20, "expressions": ["11 + 9", "16 + 4", "17 + 3"] }
    },
    {
      "set": "B", "id": "fruit_B_r3_basket10_dense", "round": 3, "stage": 3, "type": "A", "targetSum": 10, "levelTitle": "Fill the 10 Basket",
      "pills": [
        { "a": 0, "b": 10, "id": "p1" }, { "a": 5, "b": 4, "id": "p2" }, { "a": 6, "b": 4, "id": "p3" }, { "a": 6, "b": 5, "id": "p4" },
        { "a": 2, "b": 8, "id": "p5" }, { "a": 7, "b": 4, "id": "p6" }, { "a": 5, "b": 5, "id": "p7" }, { "a": 3, "b": 5, "id": "p8" }
      ],
      "correctPills": ["p1", "p3", "p5", "p7"],
      "misconception_tags": { "p2": "sum-off-by-one-under", "p4": "sum-off-by-one-over", "p6": "sum-off-by-one-over", "p8": "sum-off-by-two-under" },
      "answer": { "correctPills": ["p1", "p3", "p5", "p7"], "targetSum": 10, "expressions": ["0 + 10", "6 + 4", "2 + 8", "5 + 5"] }
    },
    {
      "set": "B", "id": "fruit_B_r4_basket20_fluency", "round": 4, "stage": 4, "type": "A", "targetSum": 20, "levelTitle": "Fill the 20 Basket",
      "pills": [
        { "a": 16, "b": 4, "id": "p1" }, { "a": 15, "b": 4, "id": "p2" }, { "a": 13, "b": 7, "id": "p3" }, { "a": 12, "b": 7, "id": "p4" },
        { "a": 12, "b": 8, "id": "p5" }, { "a": 14, "b": 7, "id": "p6" }, { "a": 11, "b": 9, "id": "p7" }, { "a": 16, "b": 5, "id": "p8" }
      ],
      "correctPills": ["p1", "p3", "p5", "p7"],
      "misconception_tags": { "p2": "sum-off-by-one-under", "p4": "sum-off-by-one-under", "p6": "sum-off-by-one-over", "p8": "sum-off-by-one-over" },
      "answer": { "correctPills": ["p1", "p3", "p5", "p7"], "targetSum": 20, "expressions": ["16 + 4", "13 + 7", "12 + 8", "11 + 9"] }
    },
    {
      "set": "C", "id": "fruit_C_r1_basket10_warmup", "round": 1, "stage": 1, "type": "A", "targetSum": 10, "levelTitle": "Fill the 10 Basket",
      "pills": [
        { "a": 4, "b": 6, "id": "p1" }, { "a": 3, "b": 6, "id": "p2" }, { "a": 7, "b": 3, "id": "p3" }, { "a": 5, "b": 6, "id": "p4" },
        { "a": 9, "b": 1, "id": "p5" }, { "a": 8, "b": 1, "id": "p6" }, { "a": 2, "b": 9, "id": "p7" }, { "a": 6, "b": 6, "id": "p8" }
      ],
      "correctPills": ["p1", "p3", "p5"],
      "misconception_tags": { "p2": "sum-off-by-one-under", "p4": "sum-off-by-one-over", "p6": "sum-off-by-one-under", "p7": "sum-off-by-one-over", "p8": "sum-off-by-two-over" },
      "answer": { "correctPills": ["p1", "p3", "p5"], "targetSum": 10, "expressions": ["4 + 6", "7 + 3", "9 + 1"] }
    },
    {
      "set": "C", "id": "fruit_C_r2_basket20_switch", "round": 2, "stage": 2, "type": "A", "targetSum": 20, "levelTitle": "Fill the 20 Basket",
      "pills": [
        { "a": 14, "b": 6, "id": "p1" }, { "a": 13, "b": 6, "id": "p2" }, { "a": 18, "b": 2, "id": "p3" }, { "a": 17, "b": 2, "id": "p4" },
        { "a": 15, "b": 5, "id": "p5" }, { "a": 16, "b": 5, "id": "p6" }, { "a": 13, "b": 8, "id": "p7" }, { "a": 14, "b": 8, "id": "p8" }
      ],
      "correctPills": ["p1", "p3", "p5"],
      "misconception_tags": { "p2": "sum-off-by-one-under", "p4": "sum-off-by-one-under", "p6": "sum-off-by-one-over", "p7": "sum-off-by-one-over", "p8": "sum-off-by-two-over" },
      "answer": { "correctPills": ["p1", "p3", "p5"], "targetSum": 20, "expressions": ["14 + 6", "18 + 2", "15 + 5"] }
    },
    {
      "set": "C", "id": "fruit_C_r3_basket10_dense", "round": 3, "stage": 3, "type": "A", "targetSum": 10, "levelTitle": "Fill the 10 Basket",
      "pills": [
        { "a": 8, "b": 2, "id": "p1" }, { "a": 7, "b": 2, "id": "p2" }, { "a": 3, "b": 7, "id": "p3" }, { "a": 4, "b": 7, "id": "p4" },
        { "a": 6, "b": 4, "id": "p5" }, { "a": 5, "b": 4, "id": "p6" }, { "a": 1, "b": 9, "id": "p7" }, { "a": 4, "b": 8, "id": "p8" }
      ],
      "correctPills": ["p1", "p3", "p5", "p7"],
      "misconception_tags": { "p2": "sum-off-by-one-under", "p4": "sum-off-by-one-over", "p6": "sum-off-by-one-under", "p8": "sum-off-by-two-over" },
      "answer": { "correctPills": ["p1", "p3", "p5", "p7"], "targetSum": 10, "expressions": ["8 + 2", "3 + 7", "6 + 4", "1 + 9"] }
    },
    {
      "set": "C", "id": "fruit_C_r4_basket20_fluency", "round": 4, "stage": 4, "type": "A", "targetSum": 20, "levelTitle": "Fill the 20 Basket",
      "pills": [
        { "a": 17, "b": 3, "id": "p1" }, { "a": 16, "b": 3, "id": "p2" }, { "a": 14, "b": 6, "id": "p3" }, { "a": 13, "b": 6, "id": "p4" },
        { "a": 11, "b": 9, "id": "p5" }, { "a": 12, "b": 9, "id": "p6" }, { "a": 18, "b": 2, "id": "p7" }, { "a": 17, "b": 4, "id": "p8" }
      ],